{
  "schema_version": "raios.machine_manifest.v1",
  "machine": { "id": "qemu-q35-shadow", "kind": "virtual", "display_name": "QEMU q35 shadow VM", "provenance": { "machine_id": "qemu-q35-shadow", "source_kind": "launch_configuration", "source_ref": "scripts/run-stage0-qemu.ps1:-machine q35", "observed_at_utc": "2026-07-19T00:00:00Z" } },
  "cpu": {
    "architecture": { "status": "observed", "value": "x86_64", "provenance": { "machine_id": "qemu-q35-shadow", "source_kind": "launch_configuration", "source_ref": "scripts/run-stage0-qemu.ps1:qemu-system-x86_64", "observed_at_utc": "2026-07-19T00:00:00Z" } },
    "model": { "status": "observed", "value": "max", "provenance": { "machine_id": "qemu-q35-shadow", "source_kind": "launch_configuration", "source_ref": "vm-harness/shadow-vm-smoke.ps1:Cpu=max", "observed_at_utc": "2026-07-19T00:00:00Z" } },
    "features": [
      { "name": "resolved-feature-set", "status": "unknown", "value": null, "provenance": { "machine_id": "qemu-q35-shadow", "source_kind": "documentation_gap", "source_ref": "QEMU cpu=max feature expansion is not captured by the harness", "observed_at_utc": "2026-07-19T00:00:00Z" } }
    ]
  },
  "memory": {
    "total_bytes": { "status": "observed", "value": 536870912, "provenance": { "machine_id": "qemu-q35-shadow", "source_kind": "launch_configuration", "source_ref": "vm-harness/shadow-vm-smoke.ps1:GuestMemoryMB=512", "observed_at_utc": "2026-07-19T00:00:00Z" } },
    "topology": { "status": "unknown", "value": null, "provenance": { "machine_id": "qemu-q35-shadow", "source_kind": "documentation_gap", "source_ref": "Harness configures capacity but not DIMM/NUMA topology", "observed_at_utc": "2026-07-19T00:00:00Z" } },
    "regions": [
      { "id": "guest-ram-capacity", "kind": "ram", "start_bytes": 0, "length_bytes": 536870912, "status": "observed", "provenance": { "machine_id": "qemu-q35-shadow", "source_kind": "launch_configuration", "source_ref": "scripts/run-stage0-qemu.ps1:-m ${MemoryMB}M", "observed_at_utc": "2026-07-19T00:00:00Z" } }
    ]
  },
  "devices": [
    { "id": "q35", "type": "chipset", "identity": { "status": "observed", "value": "q35", "provenance": { "machine_id": "qemu-q35-shadow", "source_kind": "launch_configuration", "source_ref": "scripts/run-stage0-qemu.ps1:-machine q35", "observed_at_utc": "2026-07-19T00:00:00Z" } }, "bdf": { "status": "unknown", "value": null, "provenance": { "machine_id": "qemu-q35-shadow", "source_kind": "documentation_gap", "source_ref": "chipset BDF not pinned", "observed_at_utc": "2026-07-19T00:00:00Z" } }, "resources": [], "provenance": { "machine_id": "qemu-q35-shadow", "source_kind": "launch_configuration", "source_ref": "scripts/run-stage0-qemu.ps1", "observed_at_utc": "2026-07-19T00:00:00Z" } },
    { "id": "xhci", "type": "usb_controller", "identity": { "status": "observed", "value": "qemu-xhci", "provenance": { "machine_id": "qemu-q35-shadow", "source_kind": "launch_configuration", "source_ref": "scripts/run-stage0-qemu.ps1:-device qemu-xhci,id=xhci", "observed_at_utc": "2026-07-19T00:00:00Z" } }, "bdf": { "status": "unknown", "value": null, "provenance": { "machine_id": "qemu-q35-shadow", "source_kind": "documentation_gap", "source_ref": "BDF is assigned by QEMU and not pinned", "observed_at_utc": "2026-07-19T00:00:00Z" } }, "resources": [], "provenance": { "machine_id": "qemu-q35-shadow", "source_kind": "launch_configuration", "source_ref": "scripts/run-stage0-qemu.ps1", "observed_at_utc": "2026-07-19T00:00:00Z" } },
    { "id": "bootkbd", "type": "usb_input", "identity": { "status": "observed", "value": "usb-kbd", "provenance": { "machine_id": "qemu-q35-shadow", "source_kind": "launch_configuration", "source_ref": "scripts/run-stage0-qemu.ps1:-device usb-kbd", "observed_at_utc": "2026-07-19T00:00:00Z" } }, "bdf": { "status": "unknown", "value": null, "provenance": { "machine_id": "qemu-q35-shadow", "source_kind": "documentation_gap", "source_ref": "USB devices have no PCI BDF", "observed_at_utc": "2026-07-19T00:00:00Z" } }, "resources": [], "provenance": { "machine_id": "qemu-q35-shadow", "source_kind": "launch_configuration", "source_ref": "scripts/run-stage0-qemu.ps1", "observed_at_utc": "2026-07-19T00:00:00Z" } },
    { "id": "pointer", "type": "usb_input", "identity": { "status": "observed", "value": "usb-tablet", "provenance": { "machine_id": "qemu-q35-shadow", "source_kind": "launch_configuration", "source_ref": "scripts/run-stage0-qemu.ps1:-device usb-tablet", "observed_at_utc": "2026-07-19T00:00:00Z" } }, "bdf": { "status": "unknown", "value": null, "provenance": { "machine_id": "qemu-q35-shadow", "source_kind": "documentation_gap", "source_ref": "USB devices have no PCI BDF", "observed_at_utc": "2026-07-19T00:00:00Z" } }, "resources": [], "provenance": { "machine_id": "qemu-q35-shadow", "source_kind": "launch_configuration", "source_ref": "scripts/run-stage0-qemu.ps1", "observed_at_utc": "2026-07-19T00:00:00Z" } }
  ]
}
